{
  "schema_version": "draft_bundle.v1",
  "contact_id": "h_3c77e910",
  "gist_id": "g_33cc44dd",
  "candidates": [],
  "model_id": "gemini-2.5-flash-lite",
  "prompt_version": "draft.v1",
  "voice_pack_version": "vp_00000001",
  "validator": {
    "passed": false,
    "attempts": 2,
    "failures": [
      "forbidden_phrase",
      "register_gate"
    ]
  },
  "latency_ms": 1310,
  "as_of": "2026-08-01T09:14:00Z"
}
